{
    "ClassName": "",
    "Include": "",
    "Chance": 1.0,
    "Quantity": {
        "Min": 0.0,
        "Max": 0.0
    },
    "Health": [],
    "InventoryAttachments": [
        {
            "SlotName": "Body",
            "Items": [
                {
                    "ClassName": "GorkaEJacket_Autumn",
                    "Include": "",
                    "Chance": 1.0,
                    "Quantity": {
                        "Min": 0.0,
                        "Max": 0.0
                    },
                    "Health": [
                        {
                            "Min": 0.699999988079071,
                            "Max": 1.0,
                            "Zone": ""
                        }
                    ],
                    "InventoryAttachments": [],
                    "InventoryCargo": [],
                    "ConstructionPartsBuilt": [],
                    "Sets": []
                },
                {
                    "ClassName": "GorkaEJacket_Flat",
                    "Include": "",
                    "Chance": 1.0,
                    "Quantity": {
                        "Min": 0.0,
                        "Max": 0.0
                    },
                    "Health": [
                        {
                            "Min": 0.699999988079071,
                            "Max": 1.0,
                            "Zone": ""
                        }
                    ],
                    "InventoryAttachments": [],
                    "InventoryCargo": [],
                    "ConstructionPartsBuilt": [],
                    "Sets": []
                },
                {
                    "ClassName": "GorkaEJacket_PautRev",
                    "Include": "",
                    "Chance": 1.0,
                    "Quantity": {
                        "Min": 0.0,
                        "Max": 0.0
                    },
                    "Health": [
                        {
                            "Min": 0.699999988079071,
                            "Max": 1.0,
                            "Zone": ""
                        }
                    ],
                    "InventoryAttachments": [],
                    "InventoryCargo": [],
                    "ConstructionPartsBuilt": [],
                    "Sets": []
                },
                {
                    "ClassName": "GorkaEJacket_Summer",
                    "Include": "",
                    "Chance": 1.0,
                    "Quantity": {
                        "Min": 0.0,
                        "Max": 0.0
                    },
                    "Health": [
                        {
                            "Min": 0.699999988079071,
                            "Max": 1.0,
                            "Zone": ""
                        }
                    ],
                    "InventoryAttachments": [],
                    "InventoryCargo": [],
                    "ConstructionPartsBuilt": [],
                    "Sets": []
                },
                {
                    "ClassName": "TTsKOJacket_Camo",
                    "Include": "",
                    "Chance": 1.0,
                    "Quantity": {
                        "Min": 0.0,
                        "Max": 0.0
                    },
                    "Health": [
                        {
                            "Min": 0.699999988079071,
                            "Max": 1.0,
                            "Zone": ""
                        }
                    ],
                    "InventoryAttachments": [],
                    "InventoryCargo": [],
                    "ConstructionPartsBuilt": [],
                    "Sets": []
                },
                {
                    "ClassName": "Hoodie_Black",
                    "Include": "",
                    "Chance": 1.0,
                    "Quantity": {
                        "Min": 0.0,
                        "Max": 0.0
                    },
                    "Health": [
                        {
                            "Min": 0.699999988079071,
                            "Max": 1.0,
                            "Zone": ""
                        }
                    ],
                    "InventoryAttachments": [],
                    "InventoryCargo": [],
                    "ConstructionPartsBuilt": [],
                    "Sets": []
                },
                {
                    "ClassName": "Hoodie_Blue",
                    "Include": "",
                    "Chance": 1.0,
                    "Quantity": {
                        "Min": 0.0,
                        "Max": 0.0
                    },
                    "Health": [
                        {
                            "Min": 0.699999988079071,
                            "Max": 1.0,
                            "Zone": ""
                        }
                    ],
                    "InventoryAttachments": [],
                    "InventoryCargo": [],
                    "ConstructionPartsBuilt": [],
                    "Sets": []
                },
                {
                    "ClassName": "Hoodie_Brown",
                    "Include": "",
                    "Chance": 1.0,
                    "Quantity": {
                        "Min": 0.0,
                        "Max": 0.0
                    },
                    "Health": [
                        {
                            "Min": 0.699999988079071,
                            "Max": 1.0,
                            "Zone": ""
                        }
                    ],
                    "InventoryAttachments": [],
                    "InventoryCargo": [],
                    "ConstructionPartsBuilt": [],
                    "Sets": []
                },
                {
                    "ClassName": "Hoodie_Green",
                    "Include": "",
                    "Chance": 1.0,
                    "Quantity": {
                        "Min": 0.0,
                        "Max": 0.0
                    },
                    "Health": [
                        {
                            "Min": 0.699999988079071,
                            "Max": 1.0,
                            "Zone": ""
                        }
                    ],
                    "InventoryAttachments": [],
                    "InventoryCargo": [],
                    "ConstructionPartsBuilt": [],
                    "Sets": []
                },
                {
                    "ClassName": "Hoodie_Grey",
                    "Include": "",
                    "Chance": 1.0,
                    "Quantity": {
                        "Min": 0.0,
                        "Max": 0.0
                    },
                    "Health": [
                        {
                            "Min": 0.699999988079071,
                            "Max": 1.0,
                            "Zone": ""
                        }
                    ],
                    "InventoryAttachments": [],
                    "InventoryCargo": [],
                    "ConstructionPartsBuilt": [],
                    "Sets": []
                },
                {
                    "ClassName": "Hoodie_Red",
                    "Include": "",
                    "Chance": 1.0,
                    "Quantity": {
                        "Min": 0.0,
                        "Max": 0.0
                    },
                    "Health": [
                        {
                            "Min": 0.699999988079071,
                            "Max": 1.0,
                            "Zone": ""
                        }
                    ],
                    "InventoryAttachments": [],
                    "InventoryCargo": [],
                    "ConstructionPartsBuilt": [],
                    "Sets": []
                },
                {
                    "ClassName": "BomberJacket_Black",
                    "Include": "",
                    "Chance": 1.0,
                    "Quantity": {
                        "Min": 0.0,
                        "Max": 0.0
                    },
                    "Health": [
                        {
                            "Min": 0.699999988079071,
                            "Max": 1.0,
                            "Zone": ""
                        }
                    ],
                    "InventoryAttachments": [],
                    "InventoryCargo": [],
                    "ConstructionPartsBuilt": [],
                    "Sets": []
                },
                {
                    "ClassName": "BomberJacket_Blue",
                    "Include": "",
                    "Chance": 1.0,
                    "Quantity": {
                        "Min": 0.0,
                        "Max": 0.0
                    },
                    "Health": [
                        {
                            "Min": 0.699999988079071,
                            "Max": 1.0,
                            "Zone": ""
                        }
                    ],
                    "InventoryAttachments": [],
                    "InventoryCargo": [],
                    "ConstructionPartsBuilt": [],
                    "Sets": []
                },
                {
                    "ClassName": "BomberJacket_Brown",
                    "Include": "",
                    "Chance": 1.0,
                    "Quantity": {
                        "Min": 0.0,
                        "Max": 0.0
                    },
                    "Health": [
                        {
                            "Min": 0.699999988079071,
                            "Max": 1.0,
                            "Zone": ""
                        }
                    ],
                    "InventoryAttachments": [],
                    "InventoryCargo": [],
                    "ConstructionPartsBuilt": [],
                    "Sets": []